{
 "schema": "action-kit@1",
 "id": "n-seated-squeeze",
 "display": {
  "name": {
   "zh": "坐姿夹砖（膝内夹）",
   "en": "Seated block squeeze"
  },
  "point": {
   "zh": "双膝夹住瑜伽砖，用力夹紧",
   "en": "Squeeze the block between your knees"
  },
  "cautions": [],
  "targets": [
   "adduction"
  ],
  "methods": [
   "strength"
  ],
  "level": "beginner",
  "sided": false,
  "firstSide": null,
  "poster": {
   "dark": "assets/drill_media/hip-n-seated-squeeze.jpg",
   "light": null
  }
 },
 "media": {
  "poseHub": {
   "version": "0.2.0",
   "spec": "drill-anim/specs/n-seated-squeeze.js",
   "specSha256": "74ba65d71cf733e7929c4cc94595a33b0cf47071dc263552abda354766ea27f1"
  },
  "video": {
   "dark": {
    "asset": "assets/drill_media/hip-n-seated-squeeze.mp4",
    "loopSeconds": 8.0,
    "posterTime": 2.0
   },
   "light": null
  }
 },
 "animation": {
  "loopSeconds": 8,
  "track": "work",
  "reps": [
   [
    0.37,
    0.84,
    3.37,
    3.84
   ],
   [
    4.37,
    4.84,
    7.37,
    7.84
   ]
  ],
  "source": "Pose-Hub spec timeline (measured)"
 },
 "training": {
  "kind": "rep_updown",
  "unit": "reps",
  "sided": false,
  "leadSeconds": 1.0,
  "defaults": {
   "reps": 8,
   "sets": 1,
   "seconds": null,
   "holdSeconds": null,
   "restSeconds": 15
  },
  "cycle": {
   "seconds": 4.0,
   "offset": 0.37,
   "phases": [
    {
     "id": "go",
     "seconds": 0.45,
     "cue": "w.squeeze"
    },
    {
     "id": "hold",
     "seconds": 2.55
    },
    {
     "id": "back",
     "seconds": 0.45,
     "cue": "w.relax"
    },
    {
     "id": "rest",
     "seconds": 0.55
    }
   ],
   "source": "measured: track 'work' 3 %/97 % crossings, rep 1 of 2"
  }
 },
 "voice": {
  "lines": {
   "drill.n-seated-squeeze": {
    "zh": "坐姿夹砖（膝内夹）",
    "en": "Seated block squeeze"
   },
   "point.n-seated-squeeze": {
    "zh": "双膝夹住瑜伽砖，用力夹紧",
    "en": "Squeeze the block between your knees"
   },
   "w.squeeze": {
    "zh": "夹紧",
    "en": "Squeeze"
   },
   "w.relax": {
    "zh": "放松",
    "en": "Relax"
   }
  },
  "prepare": [
   "drill.n-seated-squeeze",
   "point.n-seated-squeeze"
  ],
  "go": "p.go",
  "count": "n.{k}",
  "lastRep": "p.last_rep",
  "nextSet": "p.again",
  "end": "p.nice",
  "switch": {
   "left": "p.switch_left",
   "right": "p.switch_right"
  },
  "firstSide": null,
  "coach": [
   "cue.strength.1",
   "cue.strength.2"
  ],
  "midHold": null
 },
 "review": {
  "why": "spec: 2 squeezes / 8 s",
  "flags": []
 }
}
